<?xml version="1.0" ?>
<contests xmlns:xsi="http://www.w3.org/2001/XMLSchema-instance"
             xsi:noNamespaceSchemaLocation="contest.xsd">
    <contest>
        <name>Test</name>
        <description>Test</description>
        <company>Test</company>
        <startDate>2019-02-01</startDate>
        <endDate>2019-03-01</endDate>
        <votes>
            <vote wg="1">3</vote>
        </votes>
    </contest>
</contests>